Titolo_Nota_Atomica,Testo_Nota,Autore_Citato,Opera_Citata,Pagine_Riferimento,Edizione_Riferimento,Sezione_Riferimento,Nota_Markdown
Il referente come fenomeno,"Per Bohr, il referente non è un oggetto indipendente dall'osservazione, ma un fenomeno. Questo cambiamento nella referenzialità è una condizione per la possibilità della conoscenza oggettiva.",Karen Barad,Meeting the Universe Halfway,198,,2.1 La Materia,"### Il referente come fenomeno<br><br>**Sezione:** [[La Materia]]<br>**Autori:** [[Karen Barad]]<br><br>**Concetti Chiave:** Referente, Fenomeno, Oggettività, Fisica Quantistica<br><br>Secondo il quadro epistemologico di Bohr, la referenzialità deve essere riconcepita: il referente non è un oggetto indipendente dall'osservazione, ma un fenomeno. Questo cambiamento nella referenzialità è una condizione per la possibilità della conoscenza oggettiva.<br><br>> *In breve, una condizione per la conoscenza oggettiva è che il referente sia un fenomeno (e non un oggetto indipendente dall'osservazione).*<br><br>**Fonte:** Meeting the Universe Halfway, p. 198"
Materia come agente vivo ed esuberante,"La materia non è inerme, ma un (s)oggetto vivo e attivo, la cui esuberante creatività e agenzia non possono mai essere contenute o esaurite.",Karen Barad,Meeting the Universe Halfway,177,,2.1 La Materia,"### Materia come agente vivo ed esuberante<br><br>**Sezione:** [[La Materia]]<br>**Autori:** [[Karen Barad]]<br><br>**Concetti Chiave:** Materia, Agency, Antropocentrismo, Creatività<br><br>La materia non è inerme né attende la plasmabilità umana: è duttile e malleabile anche da altri (s)oggetti coinvolti nelle intra-azioni. È un (s)oggetto vivo al pari del mondo che chiamiamo ""animato"".<br><br>> *L'esuberanza del mondo, la sua esuberante creatività, non può mai essere contenuta o sospesa. L'agency non finisce mai; non può mai 'esaurirsi'.*<br><br>**Fonte:** Meeting the Universe Halfway, p. 177"
Agency degli assemblaggi,"L'agency non è una proprietà esclusiva dei soggetti umani, ma emerge dagli ""assemblaggi"" (assemblages), ovvero dagli incontri contingenti tra agenti umani e non-umani.",Jane Bennett,Vibrant Matter: A Political Ecology of Things,20-38,,2.1 La Materia,"### Agency degli assemblaggi<br><br>**Sezione:** [[La Materia]]<br>**Autori:** [[Jane Bennett]]<br><br>**Concetti Chiave:** Assemblaggio, Agency, Neo-materialismo<br><br>La materia non è uno strumento passivo in attesa dell'azione umana. Per Jane Bennett, l'agency non è una proprietà esclusiva dei soggetti umani, ma emerge dagli ""assemblaggi"" (assemblages), ovvero dagli incontri contingenti tra agenti umani e non-umani.<br><br>> *An assemblage is a concatenation of trans-species, trans-subjective actants whose efficacy derives from their contingent connections. [...] Agency is distributed across a variety of materialities.*<br><br>**Fonte:** Vibrant Matter, pp. 20-38"
Arte come produzione seriale capitalista,"Critica all'arte come produzione seriale e razionalizzata, che unisce l'analisi di Fisher sul realismo capitalista con la tesi di Weber sulla professionalizzazione come ""gabbia d'acciaio"" dello spirito del capitalismo.",Mark Fisher & Max Weber,Realismo capitalista / L'etica protestante e lo spirito del capitalismo,,,2.1 La Materia,"### Arte come produzione seriale capitalista<br><br>**Sezione:** [[La Materia]]<br>**Autori:** [[Mark Fisher]], [[Max Weber]]<br><br>**Concetti Chiave:** Arte Contemporanea, Realismo Capitalista, Razionalizzazione, Mercificazione<br><br>Critica alle ""fabbriche di manufatti artistici"" (es. Koons, Hirst) come catene di produzione che seguono una logica capitalista. Questa critica unisce l'analisi di Fisher sul realismo capitalista con la tesi di Weber sull'ascesi intramondana e la professionalizzazione come ""gabbia d'acciaio"" dello spirito del capitalismo.<br><br>> **Nota:** Questa è una nota concettuale di sintesi, non legata a una singola pagina.<br><br>**Fonte:** Realismo capitalista / L'etica protestante e lo spirito del capitalismo"
Ambiguità delle scene creative DIY,"Le scene creative locali (es. autoproduzioni) sono ambivalenti: da un lato resistono alla logica della fast fashion, dall'altro sono immerse nelle dinamiche della precarietà e dell'auto-imprenditorialità neoliberale.",Niccolò Morelli,Urban Research & Practice,,2025,2.1 La Materia,"### Ambiguità delle scene creative DIY<br><br>**Sezione:** [[La Materia]]<br>**Autori:** [[Niccolò Morelli]]<br><br>**Concetti Chiave:** DIY, Precarietà, Neoliberismo, Resistenza<br><br>Le scene creative locali sono un campo di tensione ambivalente. Se da un lato rappresentano un sito di resistenza alla logica della fast fashion, dall'altro sono immerse nelle dinamiche della precarietà, dove la passione si confonde con l'auto-sfruttamento e la necessità di costruire un brand personale.<br><br>> **Nota:** La fonte non è stata fornita, la citazione testuale non può essere inserita.<br><br>**Fonte:** Urban Research & Practice, 2025"
Onto-epistemologia e implicazione reciproca,"La separazione dell'epistemologia dall'ontologia è un riverbero di una metafisica che presuppone una divergenza intrinseca tra umano e non umano, soggetto e oggetto. L'onto-epistemologia riconosce che conoscere e essere sono reciprocamente implicati.",Karen Barad,Meeting the Universe Halfway,185,,2.1 La Materia,"### Onto-epistemologia e implicazione reciproca<br><br>**Sezione:** [[La Materia]]<br>**Autori:** [[Karen Barad]]<br><br>**Concetti Chiave:** Onto-epistemologia, Dualismo, Conoscenza, Essere<br><br>Le pratiche del conoscere e dell'essere non sono isolabili; sono reciprocamente implicate. Non otteniamo la conoscenza stando fuori dal mondo; conosciamo perché siamo del mondo. La separazione dell'epistemologia dall'ontologia è un riverbero di una metafisica che presuppone una divergenza intrinseca tra umano e non umano, soggetto e oggetto, mente e corpo, materia e discorso.<br><br>> *La separazione dell'epistemologia dall'ontologia è un riverbero di una metafisica che presuppone una diverenza intrinseca tra umano e non umano, soggetto e oggetto, mente e corpo, materia e discorso.*<br><br>**Fonte:** Meeting the Universe Halfway, p. 185"
Curatela come pratica discorsiva,"Le pratiche curatoriali non sono esterne all'opera, ma sono ""pratiche discorsive"" che diventano un elemento chiave nella definizione della fisicità e della materialità dell'intra-azione che ha portato alla produzione dell'opera stessa.",Karen Barad,Meeting the Universe Halfway,142-146,,2.1 La Materia,"### Curatela come pratica discorsiva<br><br>**Sezione:** [[La Materia]]<br>**Autori:** [[Karen Barad]]<br><br>**Concetti Chiave:** Curatela, Pratiche discorsive, Materialità, Apparato<br><br>Le pratiche discorsive — nell'ambiente artistico spesso dislocate dall'artista alla curatela — diventano un elemento chiave che definisce la fisicità e dunque la materialità dell'intra-azione. L'inclusione della curatela è un'estensione della teoria di Barad, per la quale le pratiche discorsive includono tutti gli apparati materiali che producono significato.<br><br>> **Nota:** Riferimento concettuale, non citazione diretta.<br><br>**Fonte:** Meeting the Universe Halfway, pp. 142-146"