Titolo_Nota_Atomica,Testo_Nota,Autore_Citato,Opera_Citata,Pagine_Riferimento,Edizione_Riferimento,Sezione_Riferimento,Nota_Markdown
Politica nomade rizomatica,"Sintesi della politica nomade di Braidotti, che sostituisce la logica lineare e gerarchica con connessioni ""rizomatiche"", ovvero non lineari, molteplici e decentralizzate.",Rosi Braidotti,Nomadic Theory,,"Columbia University Press, New York 2011",3.3 Generare nuovi mondi...,"### Politica nomade rizomatica<br><br>**Sezione:** [[Generare nuovi mondi per trovare nuove vie percorribili]]<br>**Autori:** [[Rosi Braidotti]]<br><br>**Concetti Chiave:** Politica Nomade, Rizoma, Non-linearità<br><br>Per noi rivoluzionare il contesto a cui apparteniamo è una delle missioni necessarie al fine di rompere la normatività lineare rendendola rizomatica, asincrona e indeterminata nella sua definizione temporale.<br><br>> **Nota:** Il libro non è stato fornito, la citazione testuale non può essere inserita.<br><br>**Fonte:** Nomadic Theory"
Resistenza alla crononormatività capitalista,"Proporre di ""diventare anormali"" per ""rompere la crononormatività"" è una risposta diretta alla diagnosi di Fisher. Se il ""realismo capitalista"" si fonda su una normalità che esclude alternative, la rottura di questa è il primo atto di resistenza.",Mark Fisher,Realismo capitalista,,"NERO, Roma 2017",3.3 Generare nuovi mondi...,"### Resistenza alla crononormatività capitalista<br><br>**Sezione:** [[Generare nuovi mondi per trovare nuove vie percorribili]]<br>**Autori:** [[Mark Fisher]]<br><br>**Concetti Chiave:** Crononormatività, Resistenza, Realismo Capitalista, Anormalità<br><br>Pratiche come trasformare la crononormatività e diventare anormali non si limitano a sovvertire la norma; intendono seminare nuovi possibili mondi. Questa è una risposta diretta alla diagnosi di Mark Fisher, per cui il ""realismo capitalista"" si fonda su una temporalità e una normalità che escludono ogni alternativa.<br><br>> *Il realismo capitalista [...] agisce come una sorta di barriera invisibile che limita il pensiero e l’azione.*<br><br>**Fonte:** Realismo capitalista"
Dissoluzione della dicotomia teoria/pratica,"L'idea di dissolvere la dicotomia teoria/pratica è il cuore del concetto di ""onto-epistemologia"" di Barad, secondo cui il conoscere (epistemologia) e l'essere (ontologia) sono pratiche materiali intra-attive inseparabili.",Karen Barad,Meeting the Universe Halfway,185,,3.3 Generare nuovi mondi...,"### Dissoluzione della dicotomia teoria/pratica<br><br>**Sezione:** [[Generare nuovi mondi per trovare nuove vie percorribili]]<br>**Autori:** [[Karen Barad]]<br><br>**Concetti Chiave:** Teoria/Pratica, Onto-epistemologia, Intra-azione, Dualismo<br><br>La distinzione canonica tra teoria e pratica si dissolve a favore di una materialità intra-attiva che le coinvolge entrambe. L'idea di dissolvere questa dicotomia è il cuore del concetto di ""onto-epistemologia"" di Barad, poiché conoscere ed essere sono pratiche materiali inseparabili.<br><br>> *Ciò di cui abbiamo bisogno è qualcosa come un'etico-onto-epistemologia, un apprezzamento dell'intreccio tra etica, sapere ed essere.*<br><br>**Fonte:** Meeting the Universe Halfway, p. 185"
Compost come materia viva e morta,"Il ""compost"" come assemblaggio ibrido di organico e inorganico, di vivente e non-vivente, è centrale in Haraway per superare le dicotomie moderne e pensare una soggettività processuale e non-purista.",Donna J. Haraway,Chthulucene: Sopravvivere su un pianeta infetto,147,"NERO, Roma 2019",3.3 Generare nuovi mondi...,"### Compost come materia viva e morta<br><br>**Sezione:** [[Generare nuovi mondi per trovare nuove vie percorribili]]<br>**Autori:** [[Donna J. Haraway]]<br><br>**Concetti Chiave:** Compost, Soggettività, Ibridità, Dualismo<br><br>Il compost secondo Haraway è ""materia morta e vivente insieme""; è una (s)oggettività che si costruisce nella contaminazione continua. È la figura che le permette di superare le dicotomie moderne e di pensare una soggettività processuale e non-purista.<br><br>> *Noi siamo humus, non Uomo. Siamo compost, non postumani.*<br><br>**Fonte:** Chthulucene: Sopravvivere su un pianeta infetto, p. 147"
Compost e soggettività nomade,"Fusione tra il ""compost"" di Haraway e la ""soggettività nomade"" di Braidotti. Entrambi i concetti descrivono soggettività non pure, processuali e relazionali, che si costituiscono attraverso la contaminazione e l'incontro con l'alterità.",Donna J. Haraway & Rosi Braidotti,Staying with the Trouble / Nomadic Theory,,,3.3 Generare nuovi mondi...,"### Compost e soggettività nomade<br><br>**Sezione:** [[Generare nuovi mondi per trovare nuove vie percorribili]]<br>**Autori:** [[Donna J. Haraway]], [[Rosi Braidotti]]<br><br>**Concetti Chiave:** Compost, Soggettività Nomade, Contaminazione, Divenire<br><br>La (s)oggettività nomade braidottiana, indefinita e in continuo mutamento, si inserisce nelle dinamiche di compostaggio ideologico anormale. Entrambi i concetti descrivono soggettività non pure, processuali e relazionali, che si costituiscono attraverso la contaminazione e l'incontro con l'alterità.<br><br>> **Nota:** Il libro ""Nomadic Theory"" non è stato fornito, la citazione testuale non può essere inserita.<br><br>**Fonte:** Staying with the Trouble / Nomadic Theory"
Variazione della rotazione terrestre,"L'uso del dato scientifico sulla variazione della rotazione terrestre per argomentare che la temporalità non è un contenitore astratto, ma un fenomeno materiale prodotto da intra-azioni.",Karen Barad,Meeting the Universe Halfway,,,3.3 Generare nuovi mondi...,"### Variazione della rotazione terrestre<br><br>**Sezione:** [[Generare nuovi mondi per trovare nuove vie percorribili]]<br>**Autori:** [[Karen Barad]]<br><br>**Concetti Chiave:** Temporalità, Materialità, Intra-azione, Scienza<br><br>Anche una condizione apparentemente cristallizzata come quella temporale può indeterminarsi. La variazione della rotazione terrestre, dovuta a intra-azioni con agenti interni o esterni (nucleo, ghiacciai), dimostra che la temporalità è un fenomeno materiale e non un contenitore astratto.<br><br>> **Nota:** Riferimento concettuale alla teoria di Barad, non a una citazione diretta.<br><br>**Fonte:** Meeting the Universe Halfway"
Conferma scientifica della variazione temporale,"Fonte giornalistica che riporta dati scientifici sull'accelerazione della rotazione terrestre, usata come prova empirica per confutare l'idea di una crononormatività fissa.",Sky TG24,Articolo online,,2024,3.3 Generare nuovi mondi...,"### Conferma scientifica della variazione temporale<br><br>**Sezione:** [[Generare nuovi mondi per trovare nuove vie percorribili]]<br>**Autori:** -<br><br>**Concetti Chiave:** Tempo, Rotazione Terrestre, Scienza<br><br>Fonte a supporto della tesi che la temporalità non è fissa. Esistono testimonianze scientifiche sull'incremento dell'accelerazione della Terra, dovuto a oscillazioni del nucleo o allo scioglimento dei ghiacciai.<br><br>> **Nota:** Fonte web, non è presente una citazione testuale.<br><br>**Fonte:** https://tg24.sky.it/scienze/2024/03/28/terra-giro-velocita"
Generare parentele (Making Kin),"L'invito a ""restare con il problema"" (staying with the trouble) per ""generare parentele"" e immaginare nuove forme di sopravvivenza in un mondo danneggiato, filo conduttore dell'opera di Haraway.",Donna J. Haraway,Chthulucene: Sopravvivere su un pianeta infetto,23-49,,3.3 Generare nuovi mondi...,"### Generare parentele (Making Kin)<br><br>**Sezione:** [[Generare nuovi mondi per trovare nuove vie percorribili]]<br>**Autori:** [[Donna J. Haraway]]<br><br>**Concetti Chiave:** Making Kin, Staying with the Trouble, Sopravvivenza<br><br>Immaginare nuovi mondi è una necessità; è fondamentale alimentare la narrazione harawayana che invita la collettività a pensare nuovi mondi e nuove vie percorribili.<br><br>> *Rimanere con il problema richiede di rendere parentele in modo strano. Fare parentele, non bambini! Fare parentele è un tipo di composizione con cui diveniamo-con gli uni con gli altri in nodi di specie compagne.*<br><br>**Fonte:** Chthulucene, pp. 23-49"