Titolo_Nota_Atomica,Testo_Nota,Autore_Citato,Opera_Citata,Pagine_Riferimento,Edizione_Riferimento,Sezione_Riferimento,Nota_Markdown
Approccio post-disciplinare e pensiero tentacolare,"L'approccio post-disciplinare si basa sulle ""traiettorie nomadiche"" (Braidotti) e sul ""pensiero tentacolare"" (Haraway) per tracciare connessioni inaspettate, in opposizione al sapere settoriale.",Rosi Braidotti & Donna J. Haraway,Nomadic Theory / Chthulucene,,,6.0 Ambiti di ricerca,"### Approccio post-disciplinare e pensiero tentacolare<br><br>**Sezione:** [[Ambiti di ricerca]]<br>**Autori:** [[Rosi Braidotti]], [[Donna J. Haraway]]<br><br>**Concetti Chiave:** Post-disciplinarietà, Pensiero Nomade, Pensiero Tentacolare<br><br>L'approccio post-disciplinare del progetto si basa sulle 'traiettorie nomadiche' (Braidotti) e sul 'pensiero tentacolare' (Haraway) come alternative al sapere settoriale.<br><br>> *I tentacoli ci portano a pensare-con; sono necessarie le stringhe, i fili, i legami, i percorsi e le linee aggrovigliate per stare con il problema.* (Haraway)<br><br>**Fonte:** Nomadic Theory / Chthulucene"
Disinventare la modernità,"La necessità di un nuovo approccio alla modernità, che non sia basato sulla conquista o sulla ""colonizzazione"" del pensiero, esplorando come ""disinventare"" le categorie moderne per aprirsi a nuove possibilità.",François Ewald,Disinventare la modernità. Conversazioni con François Ewald,,,6.0 Ambiti di ricerca,"### Disinventare la modernità<br><br>**Sezione:** [[Ambiti di ricerca]]<br>**Autori:** [[François Ewald]]<br><br>**Concetti Chiave:** Modernità, Critica, Disinvenzione, Pensiero<br><br>Questa domanda sulla necessità di un nuovo approccio alla modernità, che non sia basato sulla conquista o sulla 'colonizzazione' del pensiero, è al centro delle conversazioni con François Ewald, in cui si esplora come 'disinventare' le categorie moderne.<br><br>> **Nota:** Nota concettuale di sintesi, non legata a una singola pagina.<br><br>**Fonte:** Disinventare la modernità. Conversazioni con François Ewald"
Critica all'iperproduttività accademica,"Critica all'iperproduttività accademica che neutralizza il dissenso (Fisher) e al sapere come ""dispositivo"" (Foucault) che produce e regola la realtà.",Mark Fisher & Michel Foucault,Realismo capitalista / Sorvegliare e punire,,,6.0 Ambiti di ricerca,"### Critica all'iperproduttività accademica<br><br>**Sezione:** [[Ambiti di ricerca]]<br>**Autori:** [[Mark Fisher]], [[Michel Foucault]]<br><br>**Concetti Chiave:** Accademismo, Produttività, Dissenso, Dispositivo<br><br>La critica all'iperproduttività accademica che neutralizza il dissenso è basata sulla diagnosi di Fisher. Inoltre, l'idea del sapere come ""dispositivo"" (dispositif) che produce e regola la realtà è un concetto chiave di Foucault. Le discipline non sono neutre, ma sono meccanismi di potere/sapere.<br><br>> *Il potere disciplinare [...] ha per funzione principale quella di “addestrare”.* (Foucault)<br><br>**Fonte:** Realismo capitalista / Sorvegliare e punire"
"""Ambito"" come dispositivo di potere","L'""ambito"" di ricerca non è un campo neutro, ma un dispositivo di potestas (potere repressivo) che agisce attraverso etichette disciplinari e standard cristallizzati, esercitando potere epistemico, economico e simbolico.",Michel Foucault & Rosi Braidotti,,,,6.0 Ambiti di ricerca,"### ""Ambito"" come dispositivo di potere<br><br>**Sezione:** [[Ambiti di ricerca]]<br>**Autori:** [[Michel Foucault]], [[Rosi Braidotti]]<br><br>**Concetti Chiave:** Ambito, Potestas, Dispositivo, Potere Epistemico<br><br>L'""ambito"" non è neutro, ma un dispositivo di potestas (non solo potentia), che agisce attraverso etichette disciplinari e standard cristallizzati. Assumere questa consapevolezza significa riconoscere che “l’ambito” è carico di potere epistemico, economico e simbolico.<br><br>> **Nota:** Nota concettuale di sintesi, non legata a una singola pagina.<br><br>**Fonte:** -"
Progetto come apparato agenziale,"""Compost"" come ""apparato agenziale"" che, attraverso le sue intra-azioni, riconfigura attivamente il contesto. I suoi ""ambiti"" non sono preesistenti, ma emergono da questo processo performativo.",Karen Barad,Meeting the Universe Halfway,,,6.0 Ambiti di ricerca,"### Progetto come apparato agenziale<br><br>**Sezione:** [[Ambiti di ricerca]]<br>**Autori:** [[Karen Barad]]<br><br>**Concetti Chiave:** Progetto, Apparato, Agency, Performatività<br><br>La capacità del progetto di 'modificare performativamente i propri contorni' è un'applicazione del realismo agenziale di Barad. ""Compost"" si posiziona come apparato agenziale che modifica i propri contorni in relazione all’ambito con cui entra in contatto.<br><br>> **Nota:** Il libro non è stato fornito, la citazione testuale non può essere inserita.<br><br>**Fonte:** Meeting the Universe Halfway"